Item,Description
Agave fibres nes,"Including inter alia: Haiti hemp (Agave foetida); henequen (A. fourcroydes); ixtle, tampico (A. lecheguilla); maguey (A. cantala); pita (A. americana); Salvador hemp (A. letonae). See 789. The leaves of some agave varieties are used for the production of alcoholic beverages, such as aquamiel, mezcal, pulque and tequila."
"Almonds, with shell","Prunus amygdalus; P. communis; Amygdalus communis. Produced mainly in Mediterranean countries, the United States and Asia."
"Anise, badian, fennel, coriander","Include: anise (Pimpinella anisum); badian or star anise (Illicium verum); caraway (Carum carvi); coriander (Coriandrum sativum); cumin (Cuminum cyminum); fennel (Foeniculum vulgare); juniper berries (Juniperus communis). Seeds and berries from the various plants listed. They are normally used as spices, but also have industrial (e.g. in distilleries) and medicinal applications."
Apples,Malus pumila; M. sylvestris; M. communis; Pyrus malus.
Apricots,Prunus armeniaca.
Areca nuts,"Areca, betel nut (Areca catechu). Produced mainly in the Far East. Areca nuts are used mainly as masticatory. These nuts contain alkaloids (arecoline and arecaidine)."
Artichokes,Cynara scolymus.
Asparagus,Asparagus officinalis.
Avocados,Persea americana.
Bambara beans,"Bambara groundnut, earth pea (Voandzeia subterranea). These beand are grown underground in a similar way to groundnuts."
Bananas,Musa sapientum; M. cavendishii; M. nana. Bananas are normally eaten raw. Trade figures may include dried bananas. Data should be reported excluding the weight of the central stalk.
Barley,"Hordeum spp.: two-row barley (H. disticum) six-row barley (H. hexasticum) four-row barley (H. vulgare). Tolerates poorer soils and lower temperatures better than does wheat. Varieties include with husk and without (naked). Used as a livestock feed, for malt and for preparing foods. The roasted grains are a coffee substitute."
"Bastfibres, other","Including inter alia: China jute (Abutilon avicennae); Congo jute, malva, paka (Urena lobata; U. sinuata); Indian flax (Abroma augusta); kenaf, meshta (Hibiscus cannabinus); rosella hemp (H. sabdariffa); sunn hemp (Crotalaria juncea). This definition covers all textile fibres extracted from the stems of dicotyledonous plants, o/t flax, ramie, true hemp and true jute. For trade coverage see 780."
"Beans, dry","Phaseolus spp.: kidney, haricot bean (Ph. vulgaris); lima, butter bean (Ph. lunatus); adzuki bean (Ph. angularis); mungo bean, golden, green gram (Ph. aureus); black gram, urd (Ph. mungo); scarlet runner bean (Ph. coccineus); rice bean (Ph. calcaratus); moth bean (Ph. aconitifolius); tepary bean (Ph. acutifolius). Only species of Phaseolus should be included, though several countries also include certain types of beans. Commonly classified as Vigna (angularis, mungo, radiata, aconitifolia). In the past, these species were also classified as Phaseolus."
"Beans, green",Phaseolus and Vigna spp.. For shelling.
Berries nes,"Including inter alia: blackberry (Morus nigra); loganberry; white, red mulberry (M. alba; M. rubra); myrtle berry (Myrtus communis) huckleberry, dangleberry (Gaylussacia spp.). Other berries not separately identified. In some countries, some or all of the berries listed previously are reported under this general category."
Blueberries,"European blueberry, wild bilberry, whortleberry (Vaccinium myrtillus); American blueberry (V. corymbosum). Trade data may include cranberries, myrtle berries and other fruits of the genus Vaccinium."
"Brazil nuts, with shell","Brazil, Para or cream nut (Bertholletia excelsa)."
"Broad beans, horse beans, dry",Vicia faba: horse-bean (var. equina); broad bean (var. major); field bean (var. minor).
Buckwheat,"Fagopyrum esculentum (Polygonaceae). A minor cereal cultivated primarily in northern regions. Buckwheat is considered a cereal, although it does not belong to the gramineous family."
Cabbages and other brassicas,"Chinese, mustard cabbage, pak-choi (Brassica chinensis); white, red, savoy cabbage, Brussels sprouts, collards, kale and kohlrabi (Brassica oleracea all var. except botrytis)."
Canary seed,Phalaris canariensis. Minor cereal normally used as bird feed.
Carobs,"Ceratonia siliqua Carob-tree, locust bean. Includes also seeds. Mainly used as an animal feed and for industrial purposes. Rich in pectin."
Carrots and turnips,Daucus carota. Trade data may include turnips (Brassica rapa var. rapifera).
"Cashew nuts, with shell","Anacardium occidentale. Produced mainly in East Africa, India and Brazil."
Cashewapple,"Anacardium occidentale. The thickened, fleshy stem below the cashew nut. When soft it is used for jam."
Cassava,"Manioc, mandioca, yuca (Manihot esculenta, syn. M. utilissima); yuca dulce (M. palmata, syn. M. dulcis). A semi-permanent crop grown in tropical and subtropical regions. Sometimes bitter and sweet cassavas are referred to as separate species, the former being M. esculenta and the latter M. palmata, but this is incorrect since the toxicity varies according to location. Cassava is the staple food in many tropical countries. It is not traded internationally in its fresh state because tubers deteriorate very rapidly."
Cassava leaves,Manihot esculenta; M. utilissima. Young cassava leaves are eaten in some areas of Africa as a vegetable.
Castor oil seed,"Ricinus communis. Valued mainly for their oil, which is used in pharmaceutical products. Ground seedcakes are used as fertilizers (castor oil pomace)."
Cauliflowers and broccoli,"Brassica oleracea var. botrytis, subvariety cauliflora and cymosa. Includes headed broccoli."
Cereals (Rice Milled Eqv),
"Cereals, nes","Including inter alia: canagua or coaihua (Chenopodium pallidicaule); quihuicha or Inca wheat (Amaranthus caudatus); adlay or Job's tears (Coix lacryma-jobi); wild rice (Zizania aquatica). Other cereal crops that are not identified separately because of their minor relevance at the international level. Because of their limited local importance, some countries report cereals under this commodity heading that are classified individually by FAO."
"Cereals,Total","Cereals are generally of the gramineous family and, in the FAO concept, refer to crops harvested for dry grain only. Crops harvested green for forage, silage or grazingare classified as fodder crops. Also excluded are industrial crops, e.g. broom sorghum (Crude organic materials nes) and sweet sorghum when grown for syrup (Sugar crops nes). For international trade classifications, fresh cereals (other than sweet corn), whether or not suitable for use as fresh vegetables, are classified as cereals. Cereals are identified according to their genus. However, when two or more genera are sown and harvested as a mixture they should be classified and reported as ""mixed grains"". Production data are reported in terms of clean, dry weight of grains (12-14 percent moisture) in the form usually marketed. Rice, however, is reported in terms of paddy. Apart from moisture content and inedible substances such as cellulose, cereal grains contain, along with traces of minerals and vitamins, carbohydrates - mainly starches - (comprising 65-75 percent of their total weight), as well as proteins (6-12 percent) and fat (1-5 percent). The FAO definitions cover 17 primary cereals, of which one - white maize - is a component of maize. Each definition is listed along with its code, botanical name or names, and a short description. Cereal products derive either from the processing of grain through one or more mechanical or chemical operations, or from the processing of flour, meal or starch. Each cereal product is listed after the cereal from which it is derived."
Cherries,"Mazzard, sweet cherry (Prunus avium; Cerasus avium); hard-fleshed cherry (var. duracina); heart cherry (var. juliana)."
"Cherries, sour",Prunus cerasus; Cerasus acida.
Chestnut,Castanea spp.: C. vesca; C. vulgaris; C. sativa. Produced mainly in Europe and Asia.
Chick peas,"Chickpea, Bengal gram, garbanzos (Cicer arietinum)."
Chicory roots,Horium intybus; C. sativum. Unroasted chicory roots.
"Chillies and peppers, dry","Red and cayenne pepper, paprika, chillies (Capsicum frutescens; C. annuum); allspice, Jamaica pepper (Pimenta officinalis). Uncrushed or unground fresh pimentos are considered to be vegetables."
"Chillies and peppers, green","Capsicum annuum; C. fructescens; Pimenta officinalis. Production data exclude crops cultivated explicitly as spices. In contrast, trade data include these crops, provided they are fresh, uncrushed and unground."
Cinnamon (canella),"Ceylon cinnamon (Cinnamomum zeylanicum); Chinese, common cinnamon, cassia (C. cassia). The inner bark of young branches of certain trees of the Laurus family. Includes cinnamon- tree flowers, cinnamon fruit and cinnamon waste (chips), whether whole, crushed or ground."
"Citrus Fruit,Total",
Cloves,"Eugenia caryophyllata; Caryophyllus aromaticus. The whole fruit of the clove tree, including the flowers picked before maturity and dried in the sun, and the stems of the clove flowers."
"Coarse Grain, Total",
"Cocoa, beans","Theobroma cacao. The seeds contained in the fruit of the cacao- tree, including whole or broken, raw or roasted."
Coconuts,"Cocos nucifera Husked coconut. In shell, covered by the endocarp, while exocarp (the smooth outer skin) and mesocarp (the fibrous covering) are removed. Immature nuts contain a milky juice that is consumed as a refreshing drink. Mature nuts are consumed as such, or processed for copra or desiccated coconut. The flesh, from which copra/oil is extracted, constitutes 40-70% of the weight of the husked coconut. The oil content is about 36% of the flesh."
"Coffee, green","Coffea spp. (arabica, robusta, liberica). Raw coffee in all forms."
Coir,Cocos nucifera. Coir fibre is obtained from the fibrous covering of the mesocarp. For trade coverage see 789.
Cotton lint,"Gossypium spp. Fibres from ginning seed cotton that have not been carded or combed. Trade data also include fibres that have been cleaned, bleached, dyed or rendered absorbent."
Cottonseed,Used for extracting oil.
"Cow peas, dry","Cowpea, blackeye pea/bean (Vigna sinensis; Dolichos sinensis)."
Cranberries,"American cranberry (Vaccinium macrocarpon); European cranberry (V. oxycoccus). Trade data may include blueberries, myrtle berries and other fruits of the genus Vaccinium."
Cucumbers and gherkins,Cucumis sativus.
Currants,Black (Ribes nigrum); red and white (R. rubrum). Trade data may sometimes include gooseberries.
Dates,Phoenix dactylifera. Includes fresh and dried fruit.
Eggplants (aubergines),Solanum melongena. Also called aubergines.
Fibre crops nes,"Including inter alia: alfa, esparto (Lygeum spartum; Stipa tenacissima); bowstring hemp (Sansevieria spp.); caroa (Neoglaziovia variegata); fuque fibre (Furcraea macrophylla); Mauritius hemp (F. gigantea); New Zealand flax (Phormium tenax); palma ixtle (Samuela carnerosana). Other fibres that are not identified separately because of their minor relevance at the international level. Because of their limited local importance, some countries report vegetable fibres under this commodity heading that are classified individually by FAO. The fibre is obtained from the leaves, stalks or fruit of the plant. In instances where the fibrous part is normally used for other purposes, data cover only those fibres intended for spinning. For trade coverage see 789."
Fibre Crops Primary,"Vegetal Fibres obtained from annual and perennial plants are used to produce thread and yarn that are manufactured into fabrics. These manufactured products are not classified as agricultural, and therefore are not included in the FAO definitions. Among vegetal fibres, FAO includes 12 primary crops and five derived agricultural products. The code and name of each of these crops is listed below, along with its botanical name, or names, and a short description where necessary. Certain fibre crops yield seeds used for sowing and for processing into oil and cake, and these are listed with oil-bearing crops and derived products."
Figs,Ficus carica.
Flax fibre and tow,"Broken, scutched, hackled etc. but not spun. Traditionally, FAO has used this commodity to identify production in its raw state; in reality, the primary agricultural product is the commodity 771, which can either be used for the production of fibre or for other purposes."
Fonio,Digitaria spp.: fonio or findi (D. exilis); black fonio or hungry rice (D. iburua). A minor cereal of importance only in West Africa where it is eaten in place of rice during famines. The seeds are cooked by steaming the whole grain.
"Fruit excl Melons,Total",
"Fruit, citrus nes",Including inter alia: bergamot (Citrus bergamia); citron (C. medica var. cedrata); chinotto (C. myrtifolia); kumquat (Fortunella japonica). Some minor varieties of citrus are used primarily in the preparation of perfumes and soft drinks.
"Fruit, fresh nes","Including inter alia: azarole (Crataegus azarolus); babaco (Carica pentagona); elderberry (Sambucus nigra); jujube (Zizyphus jujuba); litchi (nephelium litchi); loquat (Eriobotrya japonica); medlar (Mespilus germanica); pawpaw (Asimina triloba); pomegranate (Punica granatum); prickly pear (Opuntia ficus-indica); rose hips (Rosa spp.); rowanberry (Sorbus aucuparia); service-apple (Sorbus domestica); tamarind (Tamarindus indica); tree-strawberry (Arbutus unedo). Other fresh fruit that are not identified separately because of their minor relevance at the international level. Because of their limited local importance, some countries report fresh fruit under this heading that are classified separately by FAO."
"Fruit, pome nes","Other pome fruit not separately identified. In some countries apples, pears and quinces are reported under this general category."
"Fruit, stone nes","Other stone fruit not separately identified. In some countries, apricots, cherries, peaches, nectarines and plums are reported under this general category."
"Fruit, tropical fresh nes","Including inter alia: breadfruit (Artocarpus incisa); carambola (Averrhoa carambola); cherimoya, custard apple (Annona spp.); durian (Durio zibethinus); feijoa (Feijoa sellowiana); guava (Psidium guajava); hog plum, mombin (Spondias spp.); jackfruit (Artocarpus integrifolia); longan (nephelium longan); mammee (Mammea americana); mangosteen (Garcinia mangostana); naranjillo (Solanum quitoense); passion fruit (Passiflora edulis); rambutan (nephelium lappaceum); sapote, mamey colorado (Calocarpum mammosum); sapodilla (Achras sapota); star apple, cainito (Chrysophyllum spp.). Other tropical fresh fruit that are not identified separately because of their minor relevance at the international level. In some countries mangoes, avocados, pineapples, dates and papayas are reported under this general category."
Garlic,Allium sativum.
Ginger,"Zingiber officinale. Rhizome of a perennial herb. It also is used for making beverages. Includes fresh, provisionally preserved or dried, whereas ginger preserved in sugar or syrup is excluded."
Gooseberries,"Ribes grossularia. Trade data may sometimes include black, white or red currants."
"Grain, mixed","A mixture of cereal species that are sown and harvested together. The mixture wheat/rye is known as meslin, but in trade is usually classified with wheat."
Grapefruit (inc. pomelos),Citrus maxima; C. grandis; C. paradisi.
Grapes,Vitis vinifera. Includes both table and wine grapes.
"Groundnuts, with shell","Arachis hypogaea. For trade data, groundnuts in shell are converted at 70% and reported on a shelled basis."
"Gums, natural","Including inter alia: balata (Manilkara bidentata); ceara (Manihot glaziovii); chicle gum (Achras zapota); guayule (Parthenium argentatum); gutta-percha (Palachium gutta); jelutong (Dieva costulana). Extracted from the latex of trees of various species. Although similar to rubber in many ways, natural gums are usually less elastic."
"Hazelnuts, with shell",Corylus avellana. Produced mainly in Mediterranean countries and the United States.
Hemp tow waste,"Cannabis sativa. This plant is cultivated for seed as well as for fibre. The fibre is obtained from the stem of the plant. Trade data include raw, retted, scutched, combed fibre, tow and waste."
Hempseed,Cannabis sativa. An annual herbaceous that is cultivated for its fibre as well as its oil. In major producing countries oil is extracted from the seeds.
Hops,"Humulus lupulus. Hop cones, fresh or dried, whether or not ground, powdered or in the form of pellets. Includes lupuline, a yellow resinous powder that covers the hop cones. Mainly used in the brewing industry to give flavour to beer."
Jojoba seed,Simmondsia californica (syn. S. chinensis). From the shrub or small tree of the Buxaceae family.
Jute,"White jute (Corchorus capsularis); red jute, tossa (C. olitorius). Trade data cover raw or processed jute (but not spun), tow and waste, yarn waste and garnetted stock and may include jute-like fibres."
Jute & Jute-like Fibres,
Kapok fibre,"Ceiba pentandra. This plant is cultivated for seed as well as for fibre. Trade data cover only fibres that have been crushed, carded or combed for spinning."
Kapok fruit,"Ceiba pentandra, Bombacaceae. The fruit of kapok contains fibre and seeds, which FAO treats as primary crops."
Kapokseed in shell,The soft shell is approximately 40-50% of the total weight of the nut.
Karite nuts (sheanuts),Butyrospermum parkii. Production data refer only to the nut contained in the fruit although the pulp around the nut is also edible.
Kiwi fruit,Actinidia chinensis.
Kola nuts,"Kola, cola, Sudan cola nut (Cola nitida; C. vera; C. acuminata). Produced mainly in Africa. Kola nuts, containing 2.4 to 2.6% caffeine, are commonly chewed by the local population. Much used in Europe and America in the production of beverages."
"Leeks, other alliaceous vegetables","Leeks (Allium porrum); chives (A. schoenoprasum); other alliac. (Allium varieties except those of 402, 403 and 406)."
Lemons and limes,Lemon (Citrus limon); sour lime (C. aurantifolia); sweet lime (C. limetta).
Lentils,Lens esculenta; Ervum lens.
Lettuce and chicory,Lactuca sativa; witloof chicory (Cichorium intybus var. foliosum); endive (C. endivia var. crispa); escarole chicory (C. endivia var. latifolia).
Linseed,Linum usitatissimum Flaxseed. An annual herbaceous that is cultivated for its fibre as well as its oil.
Lupins,"Lupinus spp.. Used primarily for feed, though in some parts of Africa and in Latin America some varieties are cultivated for human food."
Maize,"Zea mays Corn, Indian corn, mealies. A grain with a high germ content. At the national level, hybrid and ordinary maize should be reported separately owing to widely different yields and uses. Used largely for animal feed and commercial starch production."
"Maize, green","Zea mays, particularly var. saccharata. Maize harvested green for food. Saccharata variety is commonly known as sweet corn."
"Mangoes, mangosteens, guavas","Mangifera indica. Trade figures may include dried mangoes, guavas and mangosteens, including both fresh and dried."
Manila fibre (abaca),Musa textilis. The fibre is obtained from stalks of certain banana trees. For trade coverage see 789.
Maté,Ilex paraguayensis. The dried leaves of certain shrubs of the holly family which grow in South America. Prepared in a way similar to tea.
"Melons, other (inc.cantaloupes)",Cucumis melo;.
Melonseed,Cucumis melo. Includes seeds of other Cucurbitaceae.
Millet,"Including inter alia: barnyard or Japanese millet (Echinocloa frumentacea); ragi, finger or African millet (Eleusine coracana); teff (Eragrostis abyssinica); common, golden or proso millet (Panicum miliaceum); koda or ditch millet (Paspalum scrobiculatum); pearl or cattail millet (Pennisetum glaucum); foxtail millet (Setaria italica). Small-grained cereals that include a large number of different botanical species. Originated by the domestication of wild African grasses in the Nile valley and the Sahel zone, millets were subsequently taken to China and India. These cereals tolerate arid conditions and possess a small, highly nutritious grain that stores well. Used locally, both as a food and as a livestock feed. In all areas where they are cultivated, millets are used in traditional beer brewing. Also used as a feed for birds."
Mushrooms and truffles,Including inter alia: Boletus edulis; Agaricus campestris; Morchella spp. and Tuber magnatum. Cultivated or spontaneous. Includes truffles.
Mustard seed,"White mustard (Brassica alba; B. hirta; Sinapis alba); black mustard (Brassica nigra; Sinapis nigra). In addition to the oil extracted from them, white mustard seeds, may be processed into flour for food use. Black mustard seeds also yield oil and are processed into flour that is used mainly in pharmaceutical products."
"Nutmeg, mace and cardamoms","Nutmeg, mace (Myristica fragrans); cluster cardamon (Elettaria cardamomum); other cardamons (Aframomum angustifolium; A. hambury; Amomun aromaticum; A. cardamomum); Malaguetta pepper, grains of paradise (Aframomum melegueta). Nutmeg is the inner brown kernel of the fruit of the nutmeg tree. Mace is the net-like membrane between the outer shell and the kernel. Cardamon seeds are enclosed in the capsule produced by perennial herbs of the Zingiberaceae family."
"Nuts, nes","Including inter alia: pecan nut (Carya illinoensis); butter or swarri nut (Caryocar nuciferum); pili nut, Java almond, Chinese olives (Canarium spp.); paradise or sapucaia nut (Lecythis zabucajo); Queensland, macadamia nut (Macadamia ternifolia); pignolia nut (Pinus pinea). Other nuts that are not identified separately because of their minor relevance at the international level. Because of their limited local importance, some countries report nuts under this heading that are classified individually by FAO."
Oats,"Avena spp., mainly Avena sativa. A plant with open, spreading panicle-bearing large spikelets. Used primarily in breakfast foods. Makes excellent fodder for horses."
"Oil, palm","Obtained from the mesocarp of the fruit of the oil palm by pressure, and also by solvent from the residues of the pressure extraction."
"Oil, palm fruit","Elaeis guineensis. The oil palm produces bunches containing a large number of fruits with the fleshy mesocarp enclosing a kernel that is covered by a very hard shell. FAO considers palm oil (coming from the pulp) and palm kernels to be primary products. The oil extraction rate from a bunch varies from 17 to 27% for palm oil, and from 4 to 10% for palm kernels."
Oilcakes Equivalent,
Oilcrops Primary,"Oil-Bearing Crops or Oil Crops include both annual (usually called oilseeds) and perennial plants whose seeds, fruits or mesocarp and nuts are valued mainly for the edible or industrial oils that are extracted from them. Dessert and table nuts, although rich in oil, are listed under Nuts (see Chapter .). Annual oilseed plants tha are either harvested green or are used for grazing and for green manure are included with Fodder Crops (see Chapter 11.). Some of the crops included in this chapter are also fibre crops in that both the seeds and the fibres are harvested from the same plant. Such crops include: coconuts, yielding coir from the mesocarp; kapok fruit; seed cotton; linseed; and hempseed. In the case of several other crops, both the pulp of the fruit and the kernels are used for oil. The main crops of this type are oil-palm fruit and tallow tree seeds. Production data are reported in terms of dry products as marketed. Exceptions to this general rule include: groundnuts, which are reported as groundnuts in the shell; coconuts, which are reported on the basis of the weight of the nut including the woody shell, but excluding the fibrous outer husk; and palm oil, which is reported in terms of oil, by weight. Because of the very different nature of the various oil crops, the primary products cannot be aggregated in their natural weight to obtain total oil crops. For this reason, FAO converts the crops to either an oil equivalent or an oilcake equivalent before aggregating them. Only 5-6 percent of the world production of oil crops is used for seed (oilseeds) and animal feed, while about 8 percent is used for food. The remaining 86 percent is processed into oil. The fat content of oil crops varies widely. Fat content ranges from as low as 10-15 percent of the weight of coconuts to over 50 percent of the weight of sesame seeds and palm kernels. Carbohydrates, mainly polysaccharides, range from 15 to 30 percent in the oilseeds, but are generally lower in other oil-bearing crops. The protein content is very high in soybeans, at up to 40 percent, but is much lower in many other oilseeds, at 15-25 percent, and is lower still in some other oil-bearing crops."
Oilseeds nes,"Includes inter alia: beech nut (Fagus sylvatica);(Aleurites moluccana);(Carapa guineensis);(Croton tiglium);(Bassia latifolia);(Guizotia abyssinica);(Licania rigida);(Perilla frutescens);(Jatropha curcas);(Shorea robusta);(Pongamia glabra);(Astrocaryum spp.). Other oilseeds, oleaginous fruits and nuts that are not identified separately because of their minor relevance at the international level. Because of their limited local importance, some countries report commodities under this heading that are classified individually by FAO. Also included under this code are tea seeds, grape pips and tomato seeds from which oil is extracted."
Okra,Abelmoschus esculentus; Hibiscus esculentus. Also called gombo.
Olives,Olea europaea. Includes table olives and olives for oil.
"Onions, dry","Allium cepa. Includes onions at a mature stage, but not dehydrated onions."
"Onions, shallots, green",Shallots (Allium ascalonicum); onions (A. cepa); welsh onions (A. fistulosum). Young onions pulled before the bulb has enlarged; used especially in salads. Includes onion sets.
Oranges,"Common, sweet orange (Citrus sinensis); bitter orange (C. aurantium). Bitter oranges are used primarily in the preparation of marmalade."
