Item,Description
Palm kernels,Seeds of the oil palm. Babassu kernels (Orbignya speciosa) are often reported as palm kernels.
Papayas,Carica papaya.
Peaches and nectarines,Prunus persica; Amygdalus persica; Persica laevis.
Pears,Pyrus communis.
"Peas, dry",Garden pea (Pisum sativum); field pea (P. arvense).
"Peas, green","Pisum sativum. Mostly for shelling, but including edible- podded peas or sugar peas."
Pepper (piper spp.),"Black, white pepper (Piper nigrum); long pepper (P. longum). Perennial climbing vines. Includes whole, crushed or ground berries. Black pepper is produced from partially ripe berries, while white pepper is from fully ripe berries which have had the outer hull removed."
Peppermint,"Mentha spp.: M. piperita. Leaves and flowers are used in the perfumery, food and other industries."
Persimmons,Diospyros kaki: D. virginiana.
Pigeon peas,"Pigeon pea, cajan pea, Congo bean (Cajanus cajan)."
Pineapples,Ananas comosus; A. sativ. Trade figures may include dried pineapples.
Pistachios,Pistacia vera. Produced mainly in the Near East and the United States.
Plantains,Musa paradisiaca. Generally known as a cooking banana. Data should be reported excluding the weight of the central stalk.
Plums and sloes,"Greengage, mirabelle, damson (Prunus domestica); sloe (P. spinosa)."
Poppy seed,"Papaver somniferum. The source of opium, poppy seeds are also used in baking and confectionery."
Potatoes,"Solanum tuberosum Irish potato. A seasonal crop grown in temperate zones all over the world, but primarily in the northern hemisphere."
"Pulses, nes","Including inter alia: lablab or hyacinth bean (Dolichos spp.); jack or sword bean (Canavalia spp.); winged bean (Psophocarpus tetragonolobus); guar bean (Cyamopsis tetragonoloba); velvet bean (Stizolobium spp.); yam bean (Pachyrrhizus erosus);. Vigna spp. other than those included in 176 and 195 Other pulses that are not identified separately because of their minor relevance at the international level. Because of their limited local importance, some countries report pulses under this heading that are classified individually by FAO."
"Pulses,Total","Pulses are annual leguminous crops yielding from one to 12 grains or seeds of variable size, shape and color within a pod. They are used for both food and feed. The term ""pulses"" is limited to crops harvested solely for dry grain, thereby excluding crops harvested green for food (green peas, green beans, etc.) which are classified as vegetable crops. Also excluded are those crops used mainly for oil extraction (e.g. soybean and groundnuts) and leguminous crops (e.g. seeds of clover and alfalfa) that are used exclusively for sowing purposes. In addition to their food value, pulses also play an important role in cropping systems because of their ability to produce nitrogen and thereby enrich the soil. Pulses contain carbohydrates, mainly starches (55-65 percent of the total weight); proteins, including essential amino acids (18-25 percent, and much higher than cereals); and fat (1 - 4 percent). The remainder consists of water and inedible substances. Production data should be reported in terms of dry clean weight, excluding the weightof the pods. Certain kinds of pulses can be skinned and partially crushed or split toremove the seed-coat, but the resulting products are still considered raw for classification purposes. FAO covers 11 primary pulses. Each is listed below, along with its code, its botanical name, or names, and a short description. Only two processed products are included in the FAO list, namely flour of pulses and bran of pulses."
"Pumpkins, squash and gourds",Cucurbita spp. Includes marrows.
"Pyrethrum, dried","Chrysanthemum cinerariifolium. Includes leaves, stems and flowers. For insecticides, fungicides and similar products."
Quinces,Cydonia oblonga; C. vulgaris; C. japonica.
Quinoa,"Chenopodium quinoa (Chenopodiaceae). A minor cereal, which tolerates high altitudes, quinoa is cultivated primarily in andean countries. Used for food and to make chicha, a fermented beverage."
Ramie,"China grass, white ramie (Boehmeria nivea); rhea, green ramie (B. tenacissima). Ramie fibre is obtained from the bast of the plant. For trade coverage see 780."
Rapeseed,"Brassica napus var. oleifera. Valued mainly for its oil. Older varieties are rich in Erucic acid, which is considered unhealthy."
Raspberries,"Ubus idaeus. Trade data may include blackberries, mulberries and loganberries (a cross between the raspberry and blackberry)."
"Rice, paddy","Oryza spp., mainly oryza sativa. Rice grain after threshing and winnowing. Also known as rice in the husk and rough rice. Used mainly for human food."
"Roots and tubers, nes","Including inter alia: arracacha (Arracacoa xanthorrhiza); arrowroot (Maranta arundinacea); chufa (Cyperus esculentus); sago palm (Metroxylon spp.); oca and ullucu (Oxalis tuberosa and Ullucus tuberosus); yam bean, jicama (Pachyrxhizus erosus, P. angulatus); mashua (Tropaeolum tuberosum); Jerusalem artichoke, topinambur (Helianthus tuberosus). Other tubers, roots or rhizomes, fresh, that are not identified separately because of their minor relevance at the international level. Because of their limited local importance, some countries report roots and tubers under this commodity heading that are classified individually by FAO."
"Roots and Tubers,Total","Roots and Tubers are plants yielding starchy roots, tubers, rhizomes, corms and stems. They are used mainly for human food (as such or in processed form), for animal feed and for manufacturing starch, alcohol and fermented beverages including beer. The denomination ""roots and tubers"" excludes crops which are cultivated mainly for feed (mangolds, swedes) or for processing into sugar (sugar beets), and those classified as ""roots, bulb and tuberous vegetables"" (onions, garlic and beets). It does include starch and the starchy pith and flour obtained from the trunk of the sago palm and the stem of the Abyssinian banana (Musa ensete). Certain root crops, notably bitter cassava, contain toxic substances, particularly in the skins. As a result, certain processes must be undertaken to make the product safe for human consumption. Apart from their high water content (70-80 percent), these crops contain mainly carbohydrates (largely starches that account for 16-24 percent of their total weight) with very little protein and fat (0-2 percent each). Methods of propagating root crops vary. A live potato tuber or seed must be planted but only part of the live yam tuber and a piece of the stalk (not the root) in the case of cassava. Production data of root crops should be reported in terms of clean weight, i.e. free of earth and mud. FAO distinguishes among seven primary root and tuber crops. The code and name of each one appears in the list that follows, along with its botanical name, or names, and a short description. The processed products of roots and tubers are listed together with their parent primary crops."
"Rubber, natural","Hevea brasiliensis Latex. The liquid secreted by the rubber tree. Includes stabilized or concentrated latex and prevulcanized rubber latex. In trade figures, liquid weight is converted to dry weight at 60%."
Rye,"Secale cereale. A grain that is tolerant of poor soils, high latitudes and altitudes. Mainly used in making bread, whisky and beer. When fed to livestock, it is generally mixed with other grains."
Safflower seed,Carthamus tinctorius. Valued mainly for its oil. Minor uses include as a human food and as poultry feed.
Seed cotton,"Gossypium spp.: Unginned cotton. Grown for both seed and for fibre. FAO considers cottonseed, cotton lint and linters to be primary products. Lint content ranges from 30 to 40%, seed 55 to 65%, and linters 2 to 5% though they are not always separated."
Sesame seed,"Sesamum indicum. Valued for its oil, but also as a food, either raw or roasted, as well as in bakery products and other food preparations."
Sisal,"Agave sisalana. Sisal fibre is obtained from the leaves of the plant. It also is used as an ornamental plant. Trade data cover fibres that are raw, prepared for spinning, and tow and waste, including yarn waste and garnetted stock."
Sorghum,"Sorghum spp.: guinea corn (S. guineense); common, milo, feterita, kaffir corn (S. vulgare); durra, jowar, kaoliang (S. dura). A cereal that has both food and feed uses. Sorghum is a major food grain in most of Africa, where it is also used in traditional beer brewing. It is desirable to report hybrid and other varieties separately."
Soybeans,"Glycine soja. The most important oil crop. Also widely consumed as a bean and in the form of various derived products because of its high protein content, e.g. soya milk, meat, etc."
"Spices, nes","Including inter alia: bay leaves (Laurus nobilis); dill seed (Anethum graveolens); fenugreek seed (Trigonella foenum-graecum); saffron (Crocus sativus); thyme (Thymus vulgaris); turmeric (Curcuma longa). Other spices that are not identified separately because of their minor relevance at the international level. Because of their limited local importance, some countries report spices under this heading that are classified individually by FAO. This heading also includes curry powder and other mixtures of different spices."
Spinach,Spinacia oleracea. Trade figures may include New Zealand spinach (Tetragonia espansa) and orache (garden) spinach (Atriplex hortensis).
Strawberries,Fragaria spp..
String beans,Phaseolus vulgaris; Vigna spp. Not for shelling.
Sugar beet,"Beta vulgaris var. altissima. In some producing countries, marginal quantities are consumed, either directly as food or in the preparation of jams."
Sugar cane,"Saccharum officinarum. In some producing countries, marginal quantities of sugar cane are consumed, either directly as food or in the form of juice."
"Sugar crops, nes","Including inter alia: sugar maple (Acer saccharum); sweet sorghum (Sorghum saccharatum); sugar palm (Arenga saccharifera). Includes minor sugar crops of local importance. In the case of saps, production is to be expressed in liquid equivalent."
Sunflower seed,Helianthus annuus. Valued mainly for its oil. Minor uses include as a human food and as feed for birds.
Sweet potatoes,"Ipomoea batatas. A seasonal crop grown in tropical and subtropical regions. Used mainly for human food. Trade data cover fresh and dried tubers, whether or not sliced or in the form or pellets."
Tallowtree seed,Borneo tallow tree (Shorea aptera; S. stenocarpa); Chinese tallow tree (Sapium sebiferum; Stillingia sebifera). Grown wild and cultivated. FAO considers vegetable tallow and stillingia oil to be primary products (see below).
"Tangerines, mandarins, clementines, satsumas","Mandarin, tangerine (Citrus reticulata); clementine, satsuma (C. unshiu)."
Taro (cocoyam),"Dasheen, eddoe, taro, old cocoyam(Colocasia esculenta). Aroids cultivated for their edible starchy corms or underground stems. Taro is grown throughout the tropics for food. Trade data cover both fresh and dried taro."
Tea,"Camellia sinensis; Thea sinensis; Thea assaamica. Includes green tea (unfermented), black tea (fermented), and partially fermented tea. Excludes green tea eaten as a vegetable."
"Tobacco, unmanufactured","Nicotiana tabacum. Unmanufactured dry tobacco, including refuse that is not stemmed or stripped, or is partly or wholly stemmed or stripped."
Tomatoes,Lycopersicon esculentum.
"Treenuts,Total","Tree NUTS are dry fruits or kernels enclosed in woody shells or hard husks, which in turn are generally covered by a thick, fleshy/fibrous outer husk that is removed during harvest. Similar products, such as groundnuts, sunflower seeds and melon seeds, although often used for similar purposes, are included with oil-bearing crops.FAO includes in this group only dessert or table nuts. Nuts that are used mainly for flavouring beverages and masticatory and stimulant nuts should be excluded. An exception is made for areca nuts and kola nuts, which FAO considers to be inedible nuts, but which are included with the nut and derived products group to be consistent with international trade classifications. Nuts used mainly for the extraction of oil or butter, (e.g. sheanuts) as well as nuts contained in other fruits (e.g. peaches) are excluded. It should be noted that some countries report certain nut crops (chestnuts, pignolia nuts) with forestry products. Production data relate to the weight of nuts in the shell or husk, but without the outer husk. The weight of the kernel contained in the nut ranges from as low as 30 percent for cashew nuts to as high as 80 percent in the case of chestnuts. The edible portion of nut kernels is, with the major exception of chestnuts, very rich in fat content at between 50 percent and 65 percent. Protein content makes up 15-20 percent and carbohydrate content is between 10 percent and 15 percent. Starch and saccharose are the main components of dry chestnuts, accounting for about 75 percent. FAO covers ten primary nut crops. Each is listed below along with its code, its botanical name, or names, and a short description. NUT PRODUCTS include shelled nuts, whole or split, and further processed products, including roasted nuts, meal/flour, paste, oil, etc. Nut oils are not separately identified in the FAO classification; instead they are included under the heading ""oil of vegetable origin nes"". The most commonly marketed oils are almon oil and cashew nut oil and its derivative cardol."
Triticale,"A minor cereal that is a cross between wheat and rye, combining the quality and yield of wheat with the hardiness of rye."
Tung nuts,Aleurites cordata; A. fordii. Valued mainly for their oil.
Vanilla,"Vanilla planifolia; V. pompona. The fruit (or bean) of a climbing plant of the orchid family. Includes whole, crushed or ground."
Vegetables Primary,"Vegetables, as classified in this group, are mainly annual plants cultivated as field and garden crops in the open and under glass, and used almost exclusively for food. Vegetables grown principally for animal feed or seed should be excluded. Certain plants, normally classified as cereals and pulses, belong to this group when harvested green, such as green maize, green peas, etc. This grouping differs from international trade classifications for vegetables in that it includes melons and watermelons, which are normally considered to be fruit crops. But, whereas fruit crops are virtually all permanent crops, melons and watermelons are similar to vegetables in that they are temporary crops. Chillies and green peppers are included in this grouping when they are harvested for consumption as vegetables and not processed into spices. FAO production data for green peas and green beans refer to the total weight including pods, although some countries report on a shelled weight basis. The weight of the pods ranges from 40 to 50 percent for peas to up to 70 percent for broad beans. Area data on small vegetable gardens are often omitted in agricultural surveys, although production estimates may be reported. Trade data for fresh vegetables also include chilled vegetables, meaning the temperature of the products has been reduced to around 0øC without the products being frozen. Vegetables contain principally water, accounting for between 70 percent and 95 percent of their weight. They are low in nutrients, but contain minerals and vitamins. FAO covers 27 primary vegetable products. Each is listed along with its code, botanical name, or names, and a short description. PRODUCTS DERIVED FROM VEGETABLES refer to processed products. Apart from a few main products, international trade classifications do not permit a sufficiently detailed classification of processed products according to the primary commodity used in the preparation. A similar situation prevails for frozen vegetables."
"Vegetables&Melons, Total","Vegetables, as classified in this group, are mainly annual plants cultivated as field and garden crops in the open and under glass, and used almost exclusively for food. Vegetables grown principally for animal feed or seed should be excluded. Certain plants, normally classified as cereals and pulses, belong to this group when harvested green, such as green maize, green peas, etc. This grouping differs from international trade classifications for vegetables in that it includes melons and watermelons, which are normally considered to be fruit crops. But, whereas fruit crops are virtually all permanent crops, melons and watermelons are similar to vegetables in that they are temporary crops. Chillies and green peppers are included in this grouping when they are harvested for consumption as vegetables and not processed into spices. FAO production data for green peas and green beans refer to the total weight including pods, although some countries report on a shelled weight basis. The weight of the pods ranges from 40 to 50 percent for peas to up to 70 percent for broad beans. Area data on small vegetable gardens are often omitted in agricultural surveys, although production estimates may be reported. Trade data for fresh vegetables also include chilled vegetables, meaning the temperature of the products has been reduced to around 0øC without the products being frozen. Vegetables contain principally water, accounting for between 70 percent and 95 percent of their weight. They are low in nutrients, but contain minerals and vitamins. FAO covers 27 primary vegetable products. Each is listed along with its code, botanical name, or names, and a short description. PRODUCTS DERIVED FROM VEGETABLES refer to processed products. Apart from a few main products, international trade classifications do not permit a sufficiently detailed classification of processed products according to the primary commodity used in the preparation. A similar situation prevails for frozen vegetables."
"Vegetables, fresh nes","Including inter alia: bamboo shoots (Bambusa spp.); beets, chards (Beta vulgaris); capers (Capparis spinosa); cardoons (Cynara cardunculus); celery (Apium graveolens); chervil (Anthriscus cerefolium); cress (Lepidium sativum); fennel (Foeniculum vulgare); horseradish (Cochlearia armoracia); marjoram, sweet (Majorana hortensis); oyster plant (Tragopogon porrifolius); parsley (Petroselinum crispum); parsnips (Pastinaca sativa); radish (Raphanus sativus); rhubarb (Rheum spp.); rutabagas, swedes (Brassica napus); savory (Satureja hortensis); scorzonera (Scorzonera hispanica); sorrel (Rumex acetosa); soybean sprouts tarragon (Artemisia dracunculus); watercress (Nasturtium officinale). Other vegetables that are not identified separately because of their minor relevance at the international level. Because of their limited local importance, some countries report vegetables under this heading that are classified individually by FAO."
"Vegetables, leguminous nes",Vicia faba. For shelling.
Vetches,Spring/common vetch (Vicia sativa). Used mainly for animal feed.
"Walnuts, with shell","Jugland spp.: J. regia. Produced in temperate zones of the Northern Hemisphere, particularly in the United States."
Watermelons,Citrullus vulgaris.
Wheat,"Triticum spp.: common (T. aestivum) durum (T. durum) spelt (T. spelta). Common and durum wheat are the main types. Among common wheat, the main varieties are spring and winter, hard and soft, and red and white. At the national level, different varieties should be reported separately, reflecting their different uses. Used mainly for human food."
Yams,"Dioscorea spp.. The principal edible yams are widely grown throughout the tropics. A starchy staple foodstuff, normally eaten as a vegetable, boiled, baked or fried. In West Africa they are consumed mainly as ""fufu"", a stiff glutinous dough. Trade data cover both fresh and dried yams."
Yautia (cocoyam),"Xanthosoma spp.; malanga, new cocoyam, ocumo, tannia (X. sagittifolium). Several plants are included in this group, some with edible tubers and others with edible stems (also called aroids). Yautia is grown mainly in the Caribbean and is used for food. Trade data cover both fresh and dried yautia."
